2020844226,"CIK KU HAROSWATI BINTI CHE KU YAHAYA	","haroswati@uitm.edu.my	",haroswati.UiTM@analysis.ouriginal.com,011-21090603,B-02-01
2020489284,"CIK KU HAROSWATI BINTI CHE KU YAHAYA	","ainulazila@uitm.edu.my	",ainulazila.UiTM@analysis.ouriginal.com,011-21090603,B-02-01
"2020482932	","DR. WAN FARIZA BINTI WAN ABDUL RAHMAN	","amri@uitm.edu.my	",amri.UiTM@analysis.ouriginal.com,011-21090603,B-02-01
"2020847258	","DR. MUHAMMAD FIRDAUS BIN MUSTAPHA	","mdfirdaus@uitm.edu.my	",firdaus.UiTM@analysis.ouriginal.com,011-21090603,B-02-01
"2021125459	","DR. ROSLIM BIN MOHAMAD	","rosli027@uitm.edu.my	",rosli027.UiTM@analysis.ouriginal.com,011-21090603,B-02-01
"2020479614	","DR. ZURIANI BINTI AHMAD ZUKARNAIN	","wfariza@uitm.edu.my	",wfariza.UiTM@analysis.ouriginal.com,011-21090603,B-02-01
2020618198,"MARHAINIS BT JAMALUDIN	","zurianiaz@uitm.edu.my	",zuraini.UiTM@analysis.ouriginal.com,011-21090603,B-02-01
